Ürün Adı,Tür,Renk,Tarz
Çocuk Streetwear (Sokak) Siyah Jean,Jean,Siyah,Streetwear (Sokak)
Erkek Classic (Klasik) Antrasit Ceket,Ceket,Antrasit,Classic (Klasik)
Erkek Casual (Günlük) Pembe Kemer,Kemer,Pembe,Casual (Günlük)
Kadın Casual (Günlük) Mavi Pantolon,Pantolon,Mavi,Casual (Günlük)
Genç (Trikotaj/Trend) Bohem Mavi Terlik,Terlik,Mavi,Bohem
Genç (Trikotaj/Trend) Formal Mor Ceket,Ceket,Mor,Formal
Bebek Basic Kırmızı T-Shirt,T-Shirt,Kırmızı,Basic
Kadın Basic Antrasit Elbise,Elbise,Antrasit,Basic
Bebek Classic (Klasik) Lacivert Jean,Jean,Lacivert,Classic (Klasik)
Genç (Trikotaj/Trend) Formal Sarı Sweatshirt,Sweatshirt,Sarı,Formal
Genç (Trikotaj/Trend) Classic (Klasik) Mor Gömlek,Gömlek,Mor,Classic (Klasik)
Genç (Trikotaj/Trend) Formal Lacivert Eşofman Alti,Eşofman Alti,Lacivert,Formal
Genç (Trikotaj/Trend) Streetwear (Sokak) Sarı Çanta,Çanta,Sarı,Streetwear (Sokak)
Kadın Formal Beyaz Pantolon,Pantolon,Beyaz,Formal
Erkek Bohem Yeşil Pantolon,Pantolon,Yeşil,Bohem
Çocuk Sportswear (Spor) Mor Elbise,Elbise,Mor,Sportswear (Spor)
Kadın Formal Sarı Sweatshirt,Sweatshirt,Sarı,Formal
Kadın Streetwear (Sokak) Çok Renkli Pantolon,Pantolon,Çok Renkli,Streetwear (Sokak)
Bebek Formal Mor Hırka,Hırka,Mor,Formal
Çocuk Casual (Günlük) Yeşil Terlik,Terlik,Yeşil,Casual (Günlük)
Çocuk Bohem Beyaz Ceket,Ceket,Beyaz,Bohem
Kadın Basic Lacivert Elbise,Elbise,Lacivert,Basic
Bebek Retro Kahverengi Mont,Mont,Kahverengi,Retro
Kadın Streetwear (Sokak) Haki Kazak,Kazak,Haki,Streetwear (Sokak)
Çocuk Bohem Hardal Terlik,Terlik,Hardal,Bohem
Çocuk Streetwear (Sokak) Turuncu Kemer,Kemer,Turuncu,Streetwear (Sokak)
Bebek Classic (Klasik) Bordo Kazak,Kazak,Bordo,Classic (Klasik)
Kadın Sportswear (Spor) Gri Gömlek,Gömlek,Gri,Sportswear (Spor)
Erkek Bohem Çok Renkli Pijama Takımı,Pijama Takımı,Çok Renkli,Bohem
Bebek Formal Çok Renkli Eşofman Alti,Eşofman Alti,Çok Renkli,Formal
Erkek Formal Siyah Terlik,Terlik,Siyah,Formal
Çocuk Bohem Gri Şort,Şort,Gri,Bohem
Erkek Formal Mor Hırka,Hırka,Mor,Formal
Genç (Trikotaj/Trend) Classic (Klasik) Kırmızı Ayakkabı,Ayakkabı,Kırmızı,Classic (Klasik)
Genç (Trikotaj/Trend) Streetwear (Sokak) Bordo Etek,Etek,Bordo,Streetwear (Sokak)
Kadın Casual (Günlük) Sarı Kazak,Kazak,Sarı,Casual (Günlük)
Bebek Casual (Günlük) Ekru Çanta,Çanta,Ekru,Casual (Günlük)
Çocuk Streetwear (Sokak) Sarı Jean,Jean,Sarı,Streetwear (Sokak)
Genç (Trikotaj/Trend) Classic (Klasik) Yeşil Gömlek,Gömlek,Yeşil,Classic (Klasik)
Erkek Sportswear (Spor) Kahverengi Pantolon,Pantolon,Kahverengi,Sportswear (Spor)
Genç (Trikotaj/Trend) Sportswear (Spor) Kahverengi Kazak,Kazak,Kahverengi,Sportswear (Spor)
Genç (Trikotaj/Trend) Bohem Bordo Elbise,Elbise,Bordo,Bohem
Kadın Formal Hardal Mont,Mont,Hardal,Formal
Bebek Retro Sarı Eşofman Alti,Eşofman Alti,Sarı,Retro
Kadın Classic (Klasik) Yeşil Jean,Jean,Yeşil,Classic (Klasik)
Genç (Trikotaj/Trend) Streetwear (Sokak) Siyah Şort,Şort,Siyah,Streetwear (Sokak)
Erkek Classic (Klasik) Yeşil Kemer,Kemer,Yeşil,Classic (Klasik)
Erkek Casual (Günlük) Yeşil Gömlek,Gömlek,Yeşil,Casual (Günlük)
Genç (Trikotaj/Trend) Streetwear (Sokak) Lacivert Şort,Şort,Lacivert,Streetwear (Sokak)
Kadın Sportswear (Spor) Kahverengi Elbise,Elbise,Kahverengi,Sportswear (Spor)
Bebek Streetwear (Sokak) Turkuaz Kemer,Kemer,Turkuaz,Streetwear (Sokak)
Kadın Classic (Klasik) Pembe İç Çamaşırı,İç Çamaşırı,Pembe,Classic (Klasik)
Çocuk Bohem Pembe Jean,Jean,Pembe,Bohem
Erkek Classic (Klasik) Mor Pijama Takımı,Pijama Takımı,Mor,Classic (Klasik)
Çocuk Classic (Klasik) Turuncu Gömlek,Gömlek,Turuncu,Classic (Klasik)
Kadın Retro Mavi Ceket,Ceket,Mavi,Retro
Kadın Formal Pembe Kazak,Kazak,Pembe,Formal
Erkek Retro Yeşil Çorap,Çorap,Yeşil,Retro
Erkek Casual (Günlük) Gri Terlik,Terlik,Gri,Casual (Günlük)
Kadın Bohem Yeşil Pantolon,Pantolon,Yeşil,Bohem
Kadın Bohem Kahverengi İç Çamaşırı,İç Çamaşırı,Kahverengi,Bohem
Bebek Casual (Günlük) Kırmızı Gömlek,Gömlek,Kırmızı,Casual (Günlük)
Bebek Formal Haki Eşofman Alti,Eşofman Alti,Haki,Formal
Bebek Sportswear (Spor) Hardal Pijama Takımı,Pijama Takımı,Hardal,Sportswear (Spor)
Kadın Casual (Günlük) Bej Mont,Mont,Bej,Casual (Günlük)
Erkek Basic Hardal Kemer,Kemer,Hardal,Basic
Genç (Trikotaj/Trend) Retro Beyaz Gömlek,Gömlek,Beyaz,Retro
Kadın Casual (Günlük) Bordo Ayakkabı,Ayakkabı,Bordo,Casual (Günlük)
Kadın Classic (Klasik) Lacivert Ayakkabı,Ayakkabı,Lacivert,Classic (Klasik)
Kadın Bohem Lacivert Çanta,Çanta,Lacivert,Bohem
Kadın Casual (Günlük) Turkuaz Jean,Jean,Turkuaz,Casual (Günlük)
Bebek Basic Lacivert Çanta,Çanta,Lacivert,Basic
Çocuk Streetwear (Sokak) Mavi Elbise,Elbise,Mavi,Streetwear (Sokak)
Kadın Formal Turuncu Elbise,Elbise,Turuncu,Formal
Erkek Casual (Günlük) Ekru Çorap,Çorap,Ekru,Casual (Günlük)
Genç (Trikotaj/Trend) Classic (Klasik) Çok Renkli Çorap,Çorap,Çok Renkli,Classic (Klasik)
Kadın Formal Hardal Pantolon,Pantolon,Hardal,Formal
Erkek Streetwear (Sokak) Sarı Kazak,Kazak,Sarı,Streetwear (Sokak)
Kadın Retro Bej Sweatshirt,Sweatshirt,Bej,Retro
Genç (Trikotaj/Trend) Casual (Günlük) Bej Terlik,Terlik,Bej,Casual (Günlük)
Erkek Sportswear (Spor) Bej Terlik,Terlik,Bej,Sportswear (Spor)
Erkek Sportswear (Spor) Gri Elbise,Elbise,Gri,Sportswear (Spor)
Genç (Trikotaj/Trend) Streetwear (Sokak) Bej Elbise,Elbise,Bej,Streetwear (Sokak)
Çocuk Retro Mavi Şort,Şort,Mavi,Retro
Erkek Bohem Beyaz Elbise,Elbise,Beyaz,Bohem
Erkek Basic Beyaz Elbise,Elbise,Beyaz,Basic
Kadın Retro Haki Kazak,Kazak,Haki,Retro
Genç (Trikotaj/Trend) Casual (Günlük) Pembe Terlik,Terlik,Pembe,Casual (Günlük)
Kadın Casual (Günlük) Lacivert Jean,Jean,Lacivert,Casual (Günlük)
Genç (Trikotaj/Trend) Sportswear (Spor) Turkuaz Sweatshirt,Sweatshirt,Turkuaz,Sportswear (Spor)
Erkek Formal Antrasit Pijama Takımı,Pijama Takımı,Antrasit,Formal
Çocuk Streetwear (Sokak) Beyaz Sweatshirt,Sweatshirt,Beyaz,Streetwear (Sokak)
Çocuk Bohem Gri Ceket,Ceket,Gri,Bohem
Kadın Sportswear (Spor) Antrasit Çanta,Çanta,Antrasit,Sportswear (Spor)
Erkek Sportswear (Spor) Pembe Hırka,Hırka,Pembe,Sportswear (Spor)
Kadın Formal Pembe Şort,Şort,Pembe,Formal
Bebek Casual (Günlük) Gri Hırka,Hırka,Gri,Casual (Günlük)
Kadın Retro Yeşil İç Çamaşırı,İç Çamaşırı,Yeşil,Retro
Kadın Streetwear (Sokak) Bej Sweatshirt,Sweatshirt,Bej,Streetwear (Sokak)
Bebek Basic Mavi T-Shirt,T-Shirt,Mavi,Basic
Çocuk Basic Lacivert Elbise,Elbise,Lacivert,Basic
Genç (Trikotaj/Trend) Basic Turuncu Ayakkabı,Ayakkabı,Turuncu,Basic
Çocuk Sportswear (Spor) Gri T-Shirt,T-Shirt,Gri,Sportswear (Spor)
Erkek Classic (Klasik) Haki Kemer,Kemer,Haki,Classic (Klasik)
Çocuk Basic Pembe Çanta,Çanta,Pembe,Basic
Genç (Trikotaj/Trend) Classic (Klasik) Çok Renkli Pijama Takımı,Pijama Takımı,Çok Renkli,Classic (Klasik)
Kadın Formal Turkuaz Eşofman Alti,Eşofman Alti,Turkuaz,Formal
Erkek Streetwear (Sokak) Pembe Gömlek,Gömlek,Pembe,Streetwear (Sokak)
Erkek Basic Pembe Sweatshirt,Sweatshirt,Pembe,Basic
Erkek Formal Ekru Çanta,Çanta,Ekru,Formal
Bebek Basic Bej Ayakkabı,Ayakkabı,Bej,Basic
Genç (Trikotaj/Trend) Sportswear (Spor) Bej Eşofman Alti,Eşofman Alti,Bej,Sportswear (Spor)
Bebek Sportswear (Spor) Pembe Mont,Mont,Pembe,Sportswear (Spor)
Çocuk Bohem Turkuaz Çanta,Çanta,Turkuaz,Bohem
Çocuk Formal Siyah Terlik,Terlik,Siyah,Formal
Genç (Trikotaj/Trend) Basic Pembe Mont,Mont,Pembe,Basic
Bebek Streetwear (Sokak) Mor Çorap,Çorap,Mor,Streetwear (Sokak)
Kadın Classic (Klasik) Kahverengi Ayakkabı,Ayakkabı,Kahverengi,Classic (Klasik)
Genç (Trikotaj/Trend) Basic Bordo Etek,Etek,Bordo,Basic
Çocuk Streetwear (Sokak) Yeşil Pantolon,Pantolon,Yeşil,Streetwear (Sokak)
Erkek Casual (Günlük) Antrasit Mont,Mont,Antrasit,Casual (Günlük)
Genç (Trikotaj/Trend) Classic (Klasik) Kahverengi Ceket,Ceket,Kahverengi,Classic (Klasik)
Genç (Trikotaj/Trend) Streetwear (Sokak) Pembe Çorap,Çorap,Pembe,Streetwear (Sokak)
Bebek Streetwear (Sokak) Kahverengi Eşofman Alti,Eşofman Alti,Kahverengi,Streetwear (Sokak)
Erkek Bohem Siyah Kazak,Kazak,Siyah,Bohem
Genç (Trikotaj/Trend) Retro Kırmızı Ceket,Ceket,Kırmızı,Retro
Kadın Classic (Klasik) Hardal Gömlek,Gömlek,Hardal,Classic (Klasik)
Bebek Basic Antrasit Çorap,Çorap,Antrasit,Basic
Genç (Trikotaj/Trend) Bohem Çok Renkli Çorap,Çorap,Çok Renkli,Bohem
Kadın Retro Mor Terlik,Terlik,Mor,Retro
Kadın Formal Haki Çorap,Çorap,Haki,Formal
Kadın Formal Kahverengi Ayakkabı,Ayakkabı,Kahverengi,Formal
Çocuk Streetwear (Sokak) Lacivert Çorap,Çorap,Lacivert,Streetwear (Sokak)
Çocuk Classic (Klasik) Ekru Elbise,Elbise,Ekru,Classic (Klasik)
Kadın Bohem Antrasit Kazak,Kazak,Antrasit,Bohem
Erkek Bohem Mavi Kazak,Kazak,Mavi,Bohem
Genç (Trikotaj/Trend) Retro Ekru Pijama Takımı,Pijama Takımı,Ekru,Retro
Kadın Bohem Beyaz Pijama Takımı,Pijama Takımı,Beyaz,Bohem
Erkek Bohem Turkuaz Eşofman Alti,Eşofman Alti,Turkuaz,Bohem
Çocuk Formal Siyah İç Çamaşırı,İç Çamaşırı,Siyah,Formal
Genç (Trikotaj/Trend) Streetwear (Sokak) Pembe Eşofman Alti,Eşofman Alti,Pembe,Streetwear (Sokak)
Çocuk Bohem Yeşil İç Çamaşırı,İç Çamaşırı,Yeşil,Bohem
Bebek Basic Siyah İç Çamaşırı,İç Çamaşırı,Siyah,Basic
Bebek Sportswear (Spor) Kırmızı Eşofman Alti,Eşofman Alti,Kırmızı,Sportswear (Spor)
Erkek Bohem Hardal Çanta,Çanta,Hardal,Bohem
Erkek Classic (Klasik) Turkuaz Kemer,Kemer,Turkuaz,Classic (Klasik)
Bebek Sportswear (Spor) Antrasit Pijama Takımı,Pijama Takımı,Antrasit,Sportswear (Spor)
Bebek Basic Haki Gömlek,Gömlek,Haki,Basic
Çocuk Basic Mor Mont,Mont,Mor,Basic
Bebek Formal Haki Eşofman Alti,Eşofman Alti,Haki,Formal
Erkek Casual (Günlük) Kahverengi Pantolon,Pantolon,Kahverengi,Casual (Günlük)
Erkek Casual (Günlük) Yeşil Sweatshirt,Sweatshirt,Yeşil,Casual (Günlük)
Kadın Casual (Günlük) Yeşil T-Shirt,T-Shirt,Yeşil,Casual (Günlük)
Kadın Sportswear (Spor) Antrasit Çanta,Çanta,Antrasit,Sportswear (Spor)
Genç (Trikotaj/Trend) Streetwear (Sokak) Gri İç Çamaşırı,İç Çamaşırı,Gri,Streetwear (Sokak)
Çocuk Sportswear (Spor) Haki Çorap,Çorap,Haki,Sportswear (Spor)
Erkek Sportswear (Spor) Çok Renkli Çanta,Çanta,Çok Renkli,Sportswear (Spor)
Genç (Trikotaj/Trend) Casual (Günlük) Gri Etek,Etek,Gri,Casual (Günlük)
Bebek Bohem Turkuaz Etek,Etek,Turkuaz,Bohem
Genç (Trikotaj/Trend) Streetwear (Sokak) Lacivert Mont,Mont,Lacivert,Streetwear (Sokak)
Genç (Trikotaj/Trend) Classic (Klasik) Bej Jean,Jean,Bej,Classic (Klasik)
Çocuk Bohem Beyaz Kemer,Kemer,Beyaz,Bohem
Genç (Trikotaj/Trend) Basic Lacivert Sweatshirt,Sweatshirt,Lacivert,Basic
Bebek Classic (Klasik) Pembe T-Shirt,T-Shirt,Pembe,Classic (Klasik)
Bebek Sportswear (Spor) Sarı Pijama Takımı,Pijama Takımı,Sarı,Sportswear (Spor)
Genç (Trikotaj/Trend) Formal Kırmızı Pijama Takımı,Pijama Takımı,Kırmızı,Formal
Bebek Retro Hardal Çanta,Çanta,Hardal,Retro
Çocuk Basic Turkuaz Pijama Takımı,Pijama Takımı,Turkuaz,Basic
Çocuk Retro Lacivert Ceket,Ceket,Lacivert,Retro
Genç (Trikotaj/Trend) Bohem Mor Ceket,Ceket,Mor,Bohem
Bebek Basic Siyah Şort,Şort,Siyah,Basic
Kadın Basic Kahverengi Hırka,Hırka,Kahverengi,Basic
Çocuk Formal Ekru Elbise,Elbise,Ekru,Formal
Genç (Trikotaj/Trend) Streetwear (Sokak) Siyah Terlik,Terlik,Siyah,Streetwear (Sokak)
Bebek Retro Yeşil Pantolon,Pantolon,Yeşil,Retro
Bebek Retro Yeşil Terlik,Terlik,Yeşil,Retro
Erkek Formal Siyah Çorap,Çorap,Siyah,Formal
Kadın Formal Turuncu Ceket,Ceket,Turuncu,Formal
Bebek Basic Sarı Kemer,Kemer,Sarı,Basic
Çocuk Basic Hardal Pijama Takımı,Pijama Takımı,Hardal,Basic
Çocuk Formal Haki Çorap,Çorap,Haki,Formal
Kadın Basic Gri Ceket,Ceket,Gri,Basic
Kadın Streetwear (Sokak) Hardal Jean,Jean,Hardal,Streetwear (Sokak)
Çocuk Formal Kahverengi Mont,Mont,Kahverengi,Formal
Çocuk Streetwear (Sokak) Mavi Jean,Jean,Mavi,Streetwear (Sokak)
Çocuk Casual (Günlük) Kırmızı Sweatshirt,Sweatshirt,Kırmızı,Casual (Günlük)
Çocuk Casual (Günlük) Antrasit Terlik,Terlik,Antrasit,Casual (Günlük)
Çocuk Sportswear (Spor) Hardal Gömlek,Gömlek,Hardal,Sportswear (Spor)
Erkek Formal Gri İç Çamaşırı,İç Çamaşırı,Gri,Formal
Bebek Basic Kahverengi İç Çamaşırı,İç Çamaşırı,Kahverengi,Basic
Çocuk Retro Beyaz Hırka,Hırka,Beyaz,Retro
Bebek Retro Lacivert Jean,Jean,Lacivert,Retro
Erkek Sportswear (Spor) Turkuaz Pantolon,Pantolon,Turkuaz,Sportswear (Spor)
Çocuk Classic (Klasik) Turkuaz Kazak,Kazak,Turkuaz,Classic (Klasik)
Genç (Trikotaj/Trend) Bohem Gri Ceket,Ceket,Gri,Bohem
Genç (Trikotaj/Trend) Streetwear (Sokak) Çok Renkli Çanta,Çanta,Çok Renkli,Streetwear (Sokak)
Bebek Retro Turuncu Ayakkabı,Ayakkabı,Turuncu,Retro
Bebek Formal Turkuaz Etek,Etek,Turkuaz,Formal
Erkek Classic (Klasik) Çok Renkli Kemer,Kemer,Çok Renkli,Classic (Klasik)
Çocuk Classic (Klasik) Mavi Mont,Mont,Mavi,Classic (Klasik)
Kadın Classic (Klasik) Yeşil Hırka,Hırka,Yeşil,Classic (Klasik)
Bebek Retro Siyah Hırka,Hırka,Siyah,Retro
Çocuk Casual (Günlük) Kahverengi Çanta,Çanta,Kahverengi,Casual (Günlük)
Çocuk Retro Bej Ceket,Ceket,Bej,Retro
Çocuk Streetwear (Sokak) Yeşil Pantolon,Pantolon,Yeşil,Streetwear (Sokak)
Genç (Trikotaj/Trend) Streetwear (Sokak) Gri Pijama Takımı,Pijama Takımı,Gri,Streetwear (Sokak)
Kadın Classic (Klasik) Haki Kazak,Kazak,Haki,Classic (Klasik)
Çocuk Formal Kırmızı Gömlek,Gömlek,Kırmızı,Formal
Bebek Formal Gri Çorap,Çorap,Gri,Formal
Genç (Trikotaj/Trend) Retro Haki Eşofman Alti,Eşofman Alti,Haki,Retro
Genç (Trikotaj/Trend) Casual (Günlük) Lacivert Çorap,Çorap,Lacivert,Casual (Günlük)
Genç (Trikotaj/Trend) Formal Ekru Pijama Takımı,Pijama Takımı,Ekru,Formal
Kadın Casual (Günlük) Lacivert T-Shirt,T-Shirt,Lacivert,Casual (Günlük)
Erkek Sportswear (Spor) Turkuaz Elbise,Elbise,Turkuaz,Sportswear (Spor)
Bebek Formal Bordo İç Çamaşırı,İç Çamaşırı,Bordo,Formal
Bebek Retro Turkuaz Hırka,Hırka,Turkuaz,Retro
Çocuk Bohem Kahverengi Pantolon,Pantolon,Kahverengi,Bohem
Erkek Sportswear (Spor) Ekru Şort,Şort,Ekru,Sportswear (Spor)
Bebek Formal Pembe Şort,Şort,Pembe,Formal
Erkek Retro Hardal Eşofman Alti,Eşofman Alti,Hardal,Retro
Çocuk Basic Ekru Pantolon,Pantolon,Ekru,Basic
Genç (Trikotaj/Trend) Casual (Günlük) Turuncu Jean,Jean,Turuncu,Casual (Günlük)
Bebek Casual (Günlük) Mor Terlik,Terlik,Mor,Casual (Günlük)
Çocuk Retro Bordo Mont,Mont,Bordo,Retro
Kadın Formal Beyaz Çorap,Çorap,Beyaz,Formal
Çocuk Retro Antrasit Terlik,Terlik,Antrasit,Retro
Erkek Streetwear (Sokak) Gri İç Çamaşırı,İç Çamaşırı,Gri,Streetwear (Sokak)
Genç (Trikotaj/Trend) Casual (Günlük) Bej Hırka,Hırka,Bej,Casual (Günlük)
Erkek Streetwear (Sokak) Pembe Terlik,Terlik,Pembe,Streetwear (Sokak)
Erkek Sportswear (Spor) Mor Jean,Jean,Mor,Sportswear (Spor)
Genç (Trikotaj/Trend) Formal Bej İç Çamaşırı,İç Çamaşırı,Bej,Formal
Bebek Streetwear (Sokak) Kahverengi Pijama Takımı,Pijama Takımı,Kahverengi,Streetwear (Sokak)
Kadın Bohem Hardal Çorap,Çorap,Hardal,Bohem
Genç (Trikotaj/Trend) Sportswear (Spor) Çok Renkli Mont,Mont,Çok Renkli,Sportswear (Spor)
Bebek Basic Haki Pantolon,Pantolon,Haki,Basic
Erkek Formal Haki Ayakkabı,Ayakkabı,Haki,Formal
Genç (Trikotaj/Trend) Retro Turkuaz Etek,Etek,Turkuaz,Retro
Genç (Trikotaj/Trend) Retro Mor Kazak,Kazak,Mor,Retro
Genç (Trikotaj/Trend) Bohem Ekru Sweatshirt,Sweatshirt,Ekru,Bohem
Kadın Streetwear (Sokak) Ekru Çorap,Çorap,Ekru,Streetwear (Sokak)
Kadın Bohem Turuncu Kemer,Kemer,Turuncu,Bohem
Bebek Bohem Ekru Gömlek,Gömlek,Ekru,Bohem
Bebek Casual (Günlük) Antrasit Eşofman Alti,Eşofman Alti,Antrasit,Casual (Günlük)
Genç (Trikotaj/Trend) Basic Bordo Kazak,Kazak,Bordo,Basic
Erkek Retro Mor Jean,Jean,Mor,Retro
Bebek Sportswear (Spor) Antrasit T-Shirt,T-Shirt,Antrasit,Sportswear (Spor)
Çocuk Basic Kahverengi Pantolon,Pantolon,Kahverengi,Basic
Erkek Basic Turuncu Çanta,Çanta,Turuncu,Basic
Çocuk Retro Turuncu Terlik,Terlik,Turuncu,Retro
Genç (Trikotaj/Trend) Classic (Klasik) Beyaz Terlik,Terlik,Beyaz,Classic (Klasik)
Kadın Classic (Klasik) Bej Ceket,Ceket,Bej,Classic (Klasik)
Erkek Retro Gri Pijama Takımı,Pijama Takımı,Gri,Retro
Erkek Casual (Günlük) Bej Hırka,Hırka,Bej,Casual (Günlük)
Çocuk Basic Beyaz Şort,Şort,Beyaz,Basic
Kadın Streetwear (Sokak) Pembe Sweatshirt,Sweatshirt,Pembe,Streetwear (Sokak)
Genç (Trikotaj/Trend) Sportswear (Spor) Pembe Ayakkabı,Ayakkabı,Pembe,Sportswear (Spor)
Erkek Bohem Kırmızı Hırka,Hırka,Kırmızı,Bohem
Bebek Sportswear (Spor) Yeşil Çanta,Çanta,Yeşil,Sportswear (Spor)
Çocuk Retro Mor Ceket,Ceket,Mor,Retro
Bebek Formal Siyah Elbise,Elbise,Siyah,Formal
Erkek Retro Kırmızı Terlik,Terlik,Kırmızı,Retro
Çocuk Bohem Turkuaz Sweatshirt,Sweatshirt,Turkuaz,Bohem
Çocuk Streetwear (Sokak) Mor Elbise,Elbise,Mor,Streetwear (Sokak)
Erkek Streetwear (Sokak) Kahverengi Eşofman Alti,Eşofman Alti,Kahverengi,Streetwear (Sokak)
Çocuk Formal Turkuaz Eşofman Alti,Eşofman Alti,Turkuaz,Formal
Bebek Formal Siyah Etek,Etek,Siyah,Formal
Erkek Retro Turkuaz T-Shirt,T-Shirt,Turkuaz,Retro
Genç (Trikotaj/Trend) Basic Yeşil Etek,Etek,Yeşil,Basic
Genç (Trikotaj/Trend) Formal Mavi Ceket,Ceket,Mavi,Formal
Erkek Formal Gri Kazak,Kazak,Gri,Formal
Genç (Trikotaj/Trend) Basic Beyaz Çorap,Çorap,Beyaz,Basic
Çocuk Basic Lacivert Kazak,Kazak,Lacivert,Basic
Kadın Sportswear (Spor) Kırmızı Pijama Takımı,Pijama Takımı,Kırmızı,Sportswear (Spor)
Genç (Trikotaj/Trend) Formal Sarı Terlik,Terlik,Sarı,Formal
Bebek Formal Haki Hırka,Hırka,Haki,Formal
Bebek Classic (Klasik) Gri Şort,Şort,Gri,Classic (Klasik)
Bebek Basic Yeşil Kazak,Kazak,Yeşil,Basic
Erkek Formal Turuncu Pantolon,Pantolon,Turuncu,Formal
Bebek Basic Gri Terlik,Terlik,Gri,Basic
Bebek Basic Turkuaz Elbise,Elbise,Turkuaz,Basic
Bebek Casual (Günlük) Yeşil Jean,Jean,Yeşil,Casual (Günlük)
Çocuk Streetwear (Sokak) Hardal Çanta,Çanta,Hardal,Streetwear (Sokak)
Çocuk Bohem Mor Pantolon,Pantolon,Mor,Bohem
Erkek Casual (Günlük) Antrasit Jean,Jean,Antrasit,Casual (Günlük)
Erkek Classic (Klasik) Kahverengi Etek,Etek,Kahverengi,Classic (Klasik)
Kadın Bohem Hardal Ceket,Ceket,Hardal,Bohem
Genç (Trikotaj/Trend) Bohem Sarı Çorap,Çorap,Sarı,Bohem
Bebek Classic (Klasik) Antrasit Kemer,Kemer,Antrasit,Classic (Klasik)
Bebek Formal Çok Renkli İç Çamaşırı,İç Çamaşırı,Çok Renkli,Formal
Kadın Retro Sarı Gömlek,Gömlek,Sarı,Retro
Çocuk Classic (Klasik) Yeşil Çorap,Çorap,Yeşil,Classic (Klasik)
Çocuk Casual (Günlük) Hardal Sweatshirt,Sweatshirt,Hardal,Casual (Günlük)
Kadın Classic (Klasik) Haki Eşofman Alti,Eşofman Alti,Haki,Classic (Klasik)
Kadın Casual (Günlük) Lacivert Çorap,Çorap,Lacivert,Casual (Günlük)
Kadın Sportswear (Spor) Ekru Gömlek,Gömlek,Ekru,Sportswear (Spor)
Erkek Streetwear (Sokak) Mavi Kemer,Kemer,Mavi,Streetwear (Sokak)
Kadın Basic Mavi Kemer,Kemer,Mavi,Basic
Erkek Formal Çok Renkli Kazak,Kazak,Çok Renkli,Formal
Genç (Trikotaj/Trend) Formal Antrasit Kazak,Kazak,Antrasit,Formal
Erkek Sportswear (Spor) Gri Hırka,Hırka,Gri,Sportswear (Spor)
Kadın Basic Sarı T-Shirt,T-Shirt,Sarı,Basic
Çocuk Casual (Günlük) Kırmızı T-Shirt,T-Shirt,Kırmızı,Casual (Günlük)
Genç (Trikotaj/Trend) Classic (Klasik) Pembe Kazak,Kazak,Pembe,Classic (Klasik)
Bebek Basic Kahverengi Pantolon,Pantolon,Kahverengi,Basic
Erkek Retro Turkuaz Ayakkabı,Ayakkabı,Turkuaz,Retro
Genç (Trikotaj/Trend) Casual (Günlük) Yeşil Ayakkabı,Ayakkabı,Yeşil,Casual (Günlük)
Bebek Casual (Günlük) Bej Ayakkabı,Ayakkabı,Bej,Casual (Günlük)
Bebek Bohem Kahverengi Gömlek,Gömlek,Kahverengi,Bohem
Bebek Classic (Klasik) Kahverengi Jean,Jean,Kahverengi,Classic (Klasik)
Genç (Trikotaj/Trend) Sportswear (Spor) Ekru Pantolon,Pantolon,Ekru,Sportswear (Spor)
Çocuk Basic Antrasit Pantolon,Pantolon,Antrasit,Basic
Genç (Trikotaj/Trend) Formal Çok Renkli Eşofman Alti,Eşofman Alti,Çok Renkli,Formal
Genç (Trikotaj/Trend) Bohem Bordo Çorap,Çorap,Bordo,Bohem
Genç (Trikotaj/Trend) Streetwear (Sokak) Gri Jean,Jean,Gri,Streetwear (Sokak)
Kadın Bohem Mor Pijama Takımı,Pijama Takımı,Mor,Bohem
Bebek Bohem Mor Şort,Şort,Mor,Bohem
Bebek Basic Ekru Jean,Jean,Ekru,Basic
Kadın Retro Sarı Elbise,Elbise,Sarı,Retro
Erkek Classic (Klasik) Lacivert Pantolon,Pantolon,Lacivert,Classic (Klasik)
Çocuk Sportswear (Spor) Gri Pijama Takımı,Pijama Takımı,Gri,Sportswear (Spor)
Genç (Trikotaj/Trend) Basic Beyaz Terlik,Terlik,Beyaz,Basic
Çocuk Bohem Pembe Jean,Jean,Pembe,Bohem
Genç (Trikotaj/Trend) Formal Bej Gömlek,Gömlek,Bej,Formal
Genç (Trikotaj/Trend) Streetwear (Sokak) Gri Sweatshirt,Sweatshirt,Gri,Streetwear (Sokak)
Kadın Classic (Klasik) Kahverengi Kazak,Kazak,Kahverengi,Classic (Klasik)
Çocuk Classic (Klasik) Hardal Sweatshirt,Sweatshirt,Hardal,Classic (Klasik)
Kadın Bohem Turkuaz Elbise,Elbise,Turkuaz,Bohem
Genç (Trikotaj/Trend) Casual (Günlük) Çok Renkli Terlik,Terlik,Çok Renkli,Casual (Günlük)
Erkek Sportswear (Spor) Haki Çanta,Çanta,Haki,Sportswear (Spor)
Çocuk Basic Bej Elbise,Elbise,Bej,Basic
Kadın Bohem Kırmızı T-Shirt,T-Shirt,Kırmızı,Bohem
Erkek Classic (Klasik) Antrasit Pantolon,Pantolon,Antrasit,Classic (Klasik)
Bebek Bohem Mavi Ayakkabı,Ayakkabı,Mavi,Bohem
Kadın Basic Ekru Çorap,Çorap,Ekru,Basic
Genç (Trikotaj/Trend) Classic (Klasik) Ekru Etek,Etek,Ekru,Classic (Klasik)
Kadın Casual (Günlük) Antrasit Gömlek,Gömlek,Antrasit,Casual (Günlük)
Bebek Bohem Haki Pantolon,Pantolon,Haki,Bohem
Bebek Bohem Çok Renkli İç Çamaşırı,İç Çamaşırı,Çok Renkli,Bohem
Genç (Trikotaj/Trend) Classic (Klasik) Mavi Elbise,Elbise,Mavi,Classic (Klasik)
Erkek Formal Pembe Sweatshirt,Sweatshirt,Pembe,Formal
Genç (Trikotaj/Trend) Formal Kahverengi Kemer,Kemer,Kahverengi,Formal
Bebek Casual (Günlük) Yeşil Gömlek,Gömlek,Yeşil,Casual (Günlük)
Çocuk Streetwear (Sokak) Mavi T-Shirt,T-Shirt,Mavi,Streetwear (Sokak)
Çocuk Basic Haki Kazak,Kazak,Haki,Basic
Bebek Bohem Siyah Jean,Jean,Siyah,Bohem
Bebek Streetwear (Sokak) Antrasit Hırka,Hırka,Antrasit,Streetwear (Sokak)
Çocuk Classic (Klasik) Hardal Ayakkabı,Ayakkabı,Hardal,Classic (Klasik)
Bebek Casual (Günlük) Beyaz Eşofman Alti,Eşofman Alti,Beyaz,Casual (Günlük)
Çocuk Bohem Lacivert Çorap,Çorap,Lacivert,Bohem
Bebek Formal Turuncu Kemer,Kemer,Turuncu,Formal
Erkek Basic Turuncu Jean,Jean,Turuncu,Basic
Bebek Basic Çok Renkli Hırka,Hırka,Çok Renkli,Basic
Erkek Streetwear (Sokak) Pembe Pantolon,Pantolon,Pembe,Streetwear (Sokak)
Bebek Classic (Klasik) Turkuaz Pijama Takımı,Pijama Takımı,Turkuaz,Classic (Klasik)
Çocuk Streetwear (Sokak) Bej Eşofman Alti,Eşofman Alti,Bej,Streetwear (Sokak)
Erkek Classic (Klasik) Kırmızı Şort,Şort,Kırmızı,Classic (Klasik)
Kadın Basic Bordo Ayakkabı,Ayakkabı,Bordo,Basic
Kadın Classic (Klasik) Antrasit Sweatshirt,Sweatshirt,Antrasit,Classic (Klasik)
Kadın Sportswear (Spor) Haki Kazak,Kazak,Haki,Sportswear (Spor)
Erkek Sportswear (Spor) Antrasit Çanta,Çanta,Antrasit,Sportswear (Spor)
Genç (Trikotaj/Trend) Retro Mor İç Çamaşırı,İç Çamaşırı,Mor,Retro
Çocuk Basic Çok Renkli Kemer,Kemer,Çok Renkli,Basic
Erkek Retro Mor Kazak,Kazak,Mor,Retro
Çocuk Casual (Günlük) Bej Çorap,Çorap,Bej,Casual (Günlük)
Erkek Formal Bordo Sweatshirt,Sweatshirt,Bordo,Formal
Erkek Casual (Günlük) Mor Çorap,Çorap,Mor,Casual (Günlük)
Erkek Classic (Klasik) Bej Sweatshirt,Sweatshirt,Bej,Classic (Klasik)
Genç (Trikotaj/Trend) Bohem Çok Renkli Çanta,Çanta,Çok Renkli,Bohem
Genç (Trikotaj/Trend) Casual (Günlük) Turkuaz Çorap,Çorap,Turkuaz,Casual (Günlük)
Kadın Basic Turkuaz Çorap,Çorap,Turkuaz,Basic
Genç (Trikotaj/Trend) Sportswear (Spor) Kahverengi Çanta,Çanta,Kahverengi,Sportswear (Spor)
Erkek Basic Mor Gömlek,Gömlek,Mor,Basic
Kadın Casual (Günlük) Bordo Pantolon,Pantolon,Bordo,Casual (Günlük)
Bebek Sportswear (Spor) Mor Ceket,Ceket,Mor,Sportswear (Spor)
Çocuk Bohem Sarı Sweatshirt,Sweatshirt,Sarı,Bohem
Genç (Trikotaj/Trend) Casual (Günlük) Ekru Pijama Takımı,Pijama Takımı,Ekru,Casual (Günlük)
Çocuk Classic (Klasik) Lacivert Şort,Şort,Lacivert,Classic (Klasik)
Çocuk Formal Turuncu Terlik,Terlik,Turuncu,Formal
Çocuk Classic (Klasik) Antrasit Çanta,Çanta,Antrasit,Classic (Klasik)
Çocuk Formal Antrasit Kemer,Kemer,Antrasit,Formal
Genç (Trikotaj/Trend) Classic (Klasik) Antrasit Eşofman Alti,Eşofman Alti,Antrasit,Classic (Klasik)
Bebek Basic Hardal Etek,Etek,Hardal,Basic
Erkek Bohem Bordo Kazak,Kazak,Bordo,Bohem
Erkek Basic Sarı Ayakkabı,Ayakkabı,Sarı,Basic
Kadın Basic Kırmızı Etek,Etek,Kırmızı,Basic
Kadın Sportswear (Spor) Mavi İç Çamaşırı,İç Çamaşırı,Mavi,Sportswear (Spor)
Çocuk Classic (Klasik) Lacivert Kazak,Kazak,Lacivert,Classic (Klasik)
Genç (Trikotaj/Trend) Casual (Günlük) Hardal Ayakkabı,Ayakkabı,Hardal,Casual (Günlük)
Kadın Bohem Çok Renkli Şort,Şort,Çok Renkli,Bohem
Kadın Sportswear (Spor) Kırmızı Kazak,Kazak,Kırmızı,Sportswear (Spor)
Bebek Basic Beyaz Çorap,Çorap,Beyaz,Basic
Genç (Trikotaj/Trend) Formal Mor Ceket,Ceket,Mor,Formal
Genç (Trikotaj/Trend) Streetwear (Sokak) Yeşil Çorap,Çorap,Yeşil,Streetwear (Sokak)
Kadın Basic Kahverengi Etek,Etek,Kahverengi,Basic
Bebek Formal Mor Kemer,Kemer,Mor,Formal
Genç (Trikotaj/Trend) Bohem Bordo Eşofman Alti,Eşofman Alti,Bordo,Bohem
Genç (Trikotaj/Trend) Sportswear (Spor) Mavi Hırka,Hırka,Mavi,Sportswear (Spor)
Bebek Basic Beyaz Elbise,Elbise,Beyaz,Basic
Genç (Trikotaj/Trend) Classic (Klasik) Gri Terlik,Terlik,Gri,Classic (Klasik)
Kadın Formal Lacivert Etek,Etek,Lacivert,Formal
Kadın Bohem Bordo Çorap,Çorap,Bordo,Bohem
Bebek Basic Yeşil Pantolon,Pantolon,Yeşil,Basic
Erkek Bohem Pembe T-Shirt,T-Shirt,Pembe,Bohem
Kadın Bohem Sarı Ayakkabı,Ayakkabı,Sarı,Bohem
