Ürün Adı,Tür,Renk,Tarz
Kadın Casual (Günlük) Sarı Pantolon,Pantolon,Sarı,Casual (Günlük)
Çocuk Sportswear (Spor) Gri Şort,Şort,Gri,Sportswear (Spor)
Çocuk Retro Beyaz Kazak,Kazak,Beyaz,Retro
Bebek Casual (Günlük) Kahverengi Kazak,Kazak,Kahverengi,Casual (Günlük)
Çocuk Streetwear (Sokak) Siyah Pantolon,Pantolon,Siyah,Streetwear (Sokak)
Genç (Trikotaj/Trend) Bohem Hardal Kazak,Kazak,Hardal,Bohem
Kadın Formal Bej Jean,Jean,Bej,Formal
Kadın Bohem Beyaz Jean,Jean,Beyaz,Bohem
Erkek Classic (Klasik) Mor Çanta,Çanta,Mor,Classic (Klasik)
Genç (Trikotaj/Trend) Casual (Günlük) Çok Renkli İç Çamaşırı,İç Çamaşırı,Çok Renkli,Casual (Günlük)
Kadın Sportswear (Spor) Turkuaz Ayakkabı,Ayakkabı,Turkuaz,Sportswear (Spor)
Erkek Basic Pembe Etek,Etek,Pembe,Basic
Bebek Sportswear (Spor) Turkuaz Ceket,Ceket,Turkuaz,Sportswear (Spor)
Çocuk Classic (Klasik) Bordo Pantolon,Pantolon,Bordo,Classic (Klasik)
Genç (Trikotaj/Trend) Casual (Günlük) Hardal Ayakkabı,Ayakkabı,Hardal,Casual (Günlük)
Erkek Bohem Kahverengi Eşofman Alti,Eşofman Alti,Kahverengi,Bohem
Erkek Basic Haki Sweatshirt,Sweatshirt,Haki,Basic
Kadın Classic (Klasik) Sarı Pantolon,Pantolon,Sarı,Classic (Klasik)
Kadın Casual (Günlük) Ekru Kemer,Kemer,Ekru,Casual (Günlük)
Çocuk Sportswear (Spor) Hardal Sweatshirt,Sweatshirt,Hardal,Sportswear (Spor)
Kadın Sportswear (Spor) Kahverengi Çorap,Çorap,Kahverengi,Sportswear (Spor)
Erkek Formal Mor Pantolon,Pantolon,Mor,Formal
Kadın Casual (Günlük) Beyaz Mont,Mont,Beyaz,Casual (Günlük)
Genç (Trikotaj/Trend) Bohem Bej Şort,Şort,Bej,Bohem
Çocuk Casual (Günlük) Kahverengi Terlik,Terlik,Kahverengi,Casual (Günlük)
Çocuk Casual (Günlük) Bej Mont,Mont,Bej,Casual (Günlük)
Erkek Basic Haki Şort,Şort,Haki,Basic
Bebek Bohem Turuncu Pijama Takımı,Pijama Takımı,Turuncu,Bohem
Bebek Retro Kırmızı Şort,Şort,Kırmızı,Retro
Çocuk Classic (Klasik) Bordo Sweatshirt,Sweatshirt,Bordo,Classic (Klasik)
Bebek Sportswear (Spor) Lacivert Pijama Takımı,Pijama Takımı,Lacivert,Sportswear (Spor)
Çocuk Classic (Klasik) Bej Terlik,Terlik,Bej,Classic (Klasik)
Çocuk Formal Ekru Pantolon,Pantolon,Ekru,Formal
Bebek Sportswear (Spor) Çok Renkli Çorap,Çorap,Çok Renkli,Sportswear (Spor)
Bebek Casual (Günlük) Sarı Çorap,Çorap,Sarı,Casual (Günlük)
Bebek Formal Çok Renkli Sweatshirt,Sweatshirt,Çok Renkli,Formal
Bebek Basic Lacivert Gömlek,Gömlek,Lacivert,Basic
Erkek Sportswear (Spor) Kırmızı Ayakkabı,Ayakkabı,Kırmızı,Sportswear (Spor)
Erkek Sportswear (Spor) Mor Çanta,Çanta,Mor,Sportswear (Spor)
Çocuk Basic Yeşil Pantolon,Pantolon,Yeşil,Basic
Erkek Sportswear (Spor) Turkuaz Eşofman Alti,Eşofman Alti,Turkuaz,Sportswear (Spor)
Çocuk Retro Sarı Çorap,Çorap,Sarı,Retro
Kadın Basic Turkuaz Pantolon,Pantolon,Turkuaz,Basic
Çocuk Streetwear (Sokak) Ekru Eşofman Alti,Eşofman Alti,Ekru,Streetwear (Sokak)
Kadın Retro Siyah Jean,Jean,Siyah,Retro
Genç (Trikotaj/Trend) Classic (Klasik) Turuncu Ayakkabı,Ayakkabı,Turuncu,Classic (Klasik)
Bebek Streetwear (Sokak) Haki Elbise,Elbise,Haki,Streetwear (Sokak)
Bebek Streetwear (Sokak) Bej Çanta,Çanta,Bej,Streetwear (Sokak)
Erkek Retro Antrasit Jean,Jean,Antrasit,Retro
Erkek Basic Mor Hırka,Hırka,Mor,Basic
Genç (Trikotaj/Trend) Formal Lacivert Sweatshirt,Sweatshirt,Lacivert,Formal
Kadın Basic Kırmızı Etek,Etek,Kırmızı,Basic
Erkek Streetwear (Sokak) Yeşil Ayakkabı,Ayakkabı,Yeşil,Streetwear (Sokak)
Bebek Casual (Günlük) Yeşil Kazak,Kazak,Yeşil,Casual (Günlük)
Genç (Trikotaj/Trend) Basic Hardal Sweatshirt,Sweatshirt,Hardal,Basic
Kadın Classic (Klasik) Hardal Çorap,Çorap,Hardal,Classic (Klasik)
Bebek Retro Bej Pantolon,Pantolon,Bej,Retro
Bebek Classic (Klasik) Pembe Ayakkabı,Ayakkabı,Pembe,Classic (Klasik)
Erkek Retro Ekru Kazak,Kazak,Ekru,Retro
Çocuk Sportswear (Spor) Bordo Çorap,Çorap,Bordo,Sportswear (Spor)
Kadın Sportswear (Spor) Turkuaz Terlik,Terlik,Turkuaz,Sportswear (Spor)
Erkek Classic (Klasik) Bordo Pijama Takımı,Pijama Takımı,Bordo,Classic (Klasik)
Çocuk Sportswear (Spor) Antrasit Ayakkabı,Ayakkabı,Antrasit,Sportswear (Spor)
Kadın Basic Ekru Hırka,Hırka,Ekru,Basic
Erkek Formal Bej Ayakkabı,Ayakkabı,Bej,Formal
Çocuk Sportswear (Spor) Hardal Mont,Mont,Hardal,Sportswear (Spor)
Genç (Trikotaj/Trend) Classic (Klasik) Çok Renkli Etek,Etek,Çok Renkli,Classic (Klasik)
Genç (Trikotaj/Trend) Sportswear (Spor) Kırmızı Ayakkabı,Ayakkabı,Kırmızı,Sportswear (Spor)
Genç (Trikotaj/Trend) Basic Çok Renkli Hırka,Hırka,Çok Renkli,Basic
Erkek Classic (Klasik) Beyaz Kemer,Kemer,Beyaz,Classic (Klasik)
Çocuk Streetwear (Sokak) Turkuaz Gömlek,Gömlek,Turkuaz,Streetwear (Sokak)
Genç (Trikotaj/Trend) Casual (Günlük) Pembe Kemer,Kemer,Pembe,Casual (Günlük)
Çocuk Formal Hardal İç Çamaşırı,İç Çamaşırı,Hardal,Formal
Bebek Formal Yeşil İç Çamaşırı,İç Çamaşırı,Yeşil,Formal
Erkek Sportswear (Spor) Lacivert Çorap,Çorap,Lacivert,Sportswear (Spor)
Bebek Retro Pembe Çorap,Çorap,Pembe,Retro
Genç (Trikotaj/Trend) Sportswear (Spor) Ekru Mont,Mont,Ekru,Sportswear (Spor)
Çocuk Bohem Ekru Şort,Şort,Ekru,Bohem
Genç (Trikotaj/Trend) Classic (Klasik) Sarı Kazak,Kazak,Sarı,Classic (Klasik)
Bebek Classic (Klasik) Yeşil Şort,Şort,Yeşil,Classic (Klasik)
Kadın Sportswear (Spor) Mor Elbise,Elbise,Mor,Sportswear (Spor)
Çocuk Bohem Beyaz Jean,Jean,Beyaz,Bohem
Kadın Sportswear (Spor) Pembe Çanta,Çanta,Pembe,Sportswear (Spor)
Çocuk Streetwear (Sokak) Turkuaz Şort,Şort,Turkuaz,Streetwear (Sokak)
Genç (Trikotaj/Trend) Retro Kahverengi Hırka,Hırka,Kahverengi,Retro
Bebek Casual (Günlük) Bej İç Çamaşırı,İç Çamaşırı,Bej,Casual (Günlük)
Genç (Trikotaj/Trend) Retro Turuncu Pantolon,Pantolon,Turuncu,Retro
Genç (Trikotaj/Trend) Basic Mavi Ceket,Ceket,Mavi,Basic
Çocuk Retro Beyaz Gömlek,Gömlek,Beyaz,Retro
Çocuk Casual (Günlük) Kahverengi Çanta,Çanta,Kahverengi,Casual (Günlük)
Kadın Formal Pembe Jean,Jean,Pembe,Formal
Çocuk Casual (Günlük) Turuncu Sweatshirt,Sweatshirt,Turuncu,Casual (Günlük)
Genç (Trikotaj/Trend) Streetwear (Sokak) Beyaz Eşofman Alti,Eşofman Alti,Beyaz,Streetwear (Sokak)
Çocuk Classic (Klasik) Hardal Sweatshirt,Sweatshirt,Hardal,Classic (Klasik)
Bebek Formal Bordo Eşofman Alti,Eşofman Alti,Bordo,Formal
Erkek Sportswear (Spor) Çok Renkli Çanta,Çanta,Çok Renkli,Sportswear (Spor)